id;phrase_en;phrase_sk;example_1;example_2;example_3
1;I didn’t realize how serious this was.;Nevšimol som si, aké vážne to bolo.;;;
2;She’s trying to figure out what went wrong.;Snaží sa zistiť, čo sa pokazilo.;;;
3;They need more time to make a final decision.;Potrebujú viac času na konečné rozhodnutie.;;;
4;We weren’t prepared for this situation.;Neboli sme pripravení na túto situáciu.;;;
5;You might want to think about your options.;Možno by si mal premyslieť svoje možnosti.;;;
6;I’m not sure how to handle this problem.;Nie som si istý, ako riešiť tento problém.;;;
7;He didn’t expect this to take so long.;Neočakával, že to bude trvať tak dlho.;;;
8;She’s looking for a way to improve her results.;Hľadá spôsob, ako zlepšiť svoje výsledky.;;;
9;They’re working on something important.;Pracujú na niečom dôležitom.;;;
10;We need to find out what happened.;Musíme zistiť, čo sa stalo.;;;
11;I’m trying to focus on what matters most.;Snažím sa sústrediť na to, čo je najdôležitejšie.;;;
12;You don’t have to decide right now.;Nemusíš sa rozhodnúť hneď teraz.;;;
13;He wants to avoid making the same mistake.;Chce sa vyhnúť tomu, aby urobil tú istú chybu.;;;
14;She’s not ready to talk about this yet.;Ešte nie je pripravená o tom hovoriť.;;;
15;They weren’t aware of the consequences.;Neuvedomovali si dôsledky.;;;
16;We should take a closer look at this issue.;Mali by sme sa na tento problém pozrieť bližšie.;;;
17;I wasn’t planning to deal with this today.;Nepočítal som s tým, že sa tým budem zaoberať dnes.;;;
18;You need to understand the bigger picture.;Musíš pochopiť širší kontext.;;;
19;He’s trying to improve his performance.;Snaží sa zlepšiť svoj výkon.;;;
20;She didn’t mean to cause any problems.;Nemala v úmysle spôsobiť žiadne problémy.;;;
21;They’re waiting to see how this develops.;Čakajú, ako sa to vyvinie.;;;
22;We need to make sure that everything is correct.;Musíme sa uistiť, že je všetko správne.;;;
23;I’m not comfortable with this decision.;Necítim sa dobre s týmto rozhodnutím.;;;
24;You might be right about this.;Možno máš pravdu.;;;
25;He needs to figure out what to do next.;Potrebuje zistiť, čo robiť ďalej.;;;
26;She’s hoping things will get better.;Dúfa, že sa veci zlepšia.;;;
27;They weren’t expecting this result.;Neočakávali tento výsledok.;;;
28;We’re trying to find a better way to do this.;Snažíme sa nájsť lepší spôsob, ako to urobiť.;;;
29;I don’t want to risk losing this opportunity.;Nechcem riskovať stratu tejto príležitosti.;;;
30;You should consider all possibilities.;Mali by ste zvážiť všetky možnosti.;;;
31;He wasn’t sure what to expect from this situation.;Nebol si istý, čo očakávať od tejto situácie.;;;
32;She’s working on improving her skills.;Pracuje na zlepšení svojich schopností.;;;
33;They need to deal with this problem.;Potrebujú sa vysporiadať s týmto problémom.;;;
34;We didn’t realize how difficult this would be.;Neuvedomili sme si, aké to bude ťažké.;;;
35;I’m trying to understand your point of view.;Snažím sa pochopiť tvoj pohľad.;;;
36;You need to be careful with this.;Musíš byť s tým opatrný.;;;
37;He wants to make progress on this project.;Chce dosiahnuť pokrok v tomto projekte.;;;
38;She wasn’t ready for this conversation.;Nebola pripravená na tento rozhovor.;;;
39;They’re trying to avoid any delays.;Snažia sa vyhnúť akýmkoľvek oneskoreniam.;;;
40;We should focus on what’s important.;Mali by sme sa sústrediť na to, čo je dôležité.;;;
41;I need to think about this carefully.;Musím si to dôkladne premyslieť.;;;
42;You might find this useful.;Možno ti to bude užitočné.;;;
43;He didn’t know how to respond to that.;Nevedel, ako na to reagovať.;;;
44;She needs more time to consider her options.;Potrebuje viac času na zváženie svojich možností.;;;
45;They’re planning to move forward with this plan.;Plánujú pokračovať s týmto plánom.;;;
46;We weren’t able to finish everything.;Neboli sme schopní dokončiť všetko.;;;
47;I wasn’t expecting that outcome.;Neočakával som taký výsledok.;;;
48;You should ask for clarification.;Mali by ste požiadať o vysvetlenie.;;;
49;He’s trying to solve this issue.;Snaží sa vyriešiť tento problém.;;;
50;She didn’t understand why this happened.;Nerozumela, prečo sa to stalo.;;;
51;They need to improve their communication.;Potrebujú zlepšiť svoju komunikáciu.;;;
52;We’re not sure what caused this.;Nie sme si istí, čo to spôsobilo.;;;
53;I want to avoid any misunderstandings.;Chcem sa vyhnúť akýmkoľvek nedorozumeniam.;;;
54;You might need to change your approach.;Možno budeš musieť zmeniť svoj prístup.;;;
55;He’s waiting for your response.;Čaká na tvoju odpoveď.;;;
56;She’s trying to stay focused on her goals.;Snaží sa zostať sústredená na svoje ciele.;;;
57;They weren’t prepared to handle this.;Neboli pripravení to zvládnuť.;;;
58;We need to act quickly to fix this problem.;Musíme konať rýchlo, aby sme tento problém vyriešili.;;;
59;I didn’t mean to interrupt you.;Nemal som v úmysle ťa prerušiť.;;;
60;You should take responsibility for this.;Mali by ste za to prevziať zodpovednosť.;;;
61;He wasn’t aware of the situation.;Nebol si vedomý situácie.;;;
62;She needs to decide what’s best for her.;Potrebuje sa rozhodnúť, čo je pre ňu najlepšie.;;;
63;They’re trying to understand the situation.;Snažia sa pochopiť situáciu.;;;
64;We didn’t expect things to turn out this way.;Neočakávali sme, že to dopadne takto.;;;
65;I’m working on something new.;Pracujem na niečom novom.;;;
66;You need to focus on your priorities.;Musíš sa sústrediť na svoje priority.;;;
67;He’s trying to find a solution to this problem.;Snaží sa nájsť riešenie tohto problému.;;;
68;She didn’t expect this reaction.;Neočakávala takúto reakciu.;;;
69;They need to be more careful with this.;Musia byť opatrnejší.;;;
70;We should discuss this further.;Mali by sme to prediskutovať podrobnejšie.;;;
71;I’m not sure if this is the right choice.;Nie som si istý, či je to správna voľba.;;;
72;You might regret this decision.;Možno budeš toto rozhodnutie ľutovať.;;;
73;He’s trying to avoid conflict.;Snaží sa vyhnúť konfliktu.;;;
74;She’s looking for a better opportunity.;Hľadá lepšiu príležitosť.;;;
75;They didn’t realize the importance of this.;Neuvedomili si dôležitosť toho.;;;
76;We need to improve the process.;Musíme zlepšiť proces.;;;
77;I wasn’t ready to hear that.;Nebol som pripravený to počuť.;;;
78;You should think about the consequences.;Mali by ste premýšľať o dôsledkoch.;;;
79;He needs to explain his reasoning.;Potrebuje vysvetliť svoje dôvody.;;;
80;She wasn’t sure how to handle the situation.;Nebola si istá, ako situáciu zvládnuť.;;;
81;They’re trying to make things better.;Snažia sa veci zlepšiť.;;;
82;We didn’t know what to expect from them.;Nevedeli sme, čo od nich očakávať.;;;
83;I’m trying to be honest about this.;Snažím sa byť v tomto úprimný.;;;
84;You don’t need to worry about that.;Nemusíš sa o to obávať.;;;
85;He’s trying to stay calm under pressure.;Snaží sa zostať pokojný pod tlakom.;;;
86;She needs to improve her confidence.;Potrebuje zlepšiť svoje sebavedomie.;;;
87;They weren’t able to solve the problem.;Neboli schopní vyriešiť problém.;;;
88;We need to understand what’s going on.;Musíme pochopiť, čo sa deje.;;;
89;I wasn’t sure how to react to that.;Nebol som si istý, ako na to reagovať.;;;
90;You should focus on improving your skills.;Mali by ste sa sústrediť na zlepšenie svojich schopností.;;;
91;He didn’t expect to feel this way.;Neočakával, že sa bude cítiť takto.;;;
92;She’s trying to build something meaningful.;Snaží sa vybudovať niečo zmysluplné.;;;
93;They need to work on their weaknesses.;Potrebujú pracovať na svojich slabinách.;;;
94;We should find a better way to handle this.;Mali by sme nájsť lepší spôsob, ako to riešiť.;;;
95;I need to be honest with you.;Musím byť k tebe úprimný.;;;
96;You might want to reconsider your decision.;Možno budeš chcieť prehodnotiť svoje rozhodnutie.;;;
97;He’s trying to understand the problem.;Snaží sa pochopiť problém.;;;
98;She didn’t realize how important this was.;Neuvedomila si, aké dôležité to bolo.;;;
99;They’re trying to fix what went wrong.;Snažia sa opraviť to, čo sa pokazilo.;;;
100;We need to move forward despite this setback.;Musíme pokračovať napriek tomuto neúspechu.;;;
101;I’m not sure if I can finish this today.;Nie som si istý, či to dnes dokážem dokončiť.;;;
102;It seems to me that we need a new plan.;Zdá sa mi, že potrebujeme nový plán.;;;
103;Do you happen to know where the meeting is?;Neviete náhodou, kde je to stretnutie?;;;
104;I’m about to start my presentation.;Práve sa chystám začať svoju prezentáciu.;;;
105;It’s not as easy as it sounds.;Nie je to také ľahké, ako to znie.;;;
106;I’m having trouble logging into my account.;Mám problém prihlásiť sa do svojho účtu.;;;
107;Feel free to contact me anytime.;Neváhajte ma kedykoľvek kontaktovať.;;;
108;I’d like to point out that we are over budget.;Rád by som podotkol, že sme prekročili rozpočet.;;;
109;The thing is, I forgot my password.;Ide o to, že som zabudol heslo.;;;
110;I’m planning on taking a vacation in July.;Plánujem, že si v júli vezmem dovolenku.;;;
111;Is there any chance you could join us?;Je nejaká šanca, že by ste sa k nám pridali?;;;
112;It’s up to you to choose the restaurant.;Je na tebe, aby si vybral reštauráciu.;;;
113;I’m used to working late hours.;Som zvyknutý pracovať neskoro do noci.;;;
114;As far as I know, the flight is on time.;Pokiaľ viem, let ide načas.;;;
115;I’m looking for a way to improve my English.;Hľadám spôsob, ako si zlepšiť angličtinu.;;;
116;It takes a lot of practice to be perfect.;Vyžaduje si to veľa praxe, aby to bolo perfektné.;;;
117;I’ve decided to move to another city.;Rozhodol som sa presťahovať do iného mesta.;;;
118;It’s hard to say when they will arrive.;Ťažko povedať, kedy dorazia.;;;
119;I’m supposed to be there at 8 AM.;Mám tam byť o 8:00 ráno.;;;
120;I’m not in the mood for a long discussion.;Nemám náladu na dlhú diskusiu.;;;
121;It doesn't matter what happened yesterday.;Nezáleží na tom, čo sa stalo včera.;;;
122;I’ll let you know when I receive the email.;Dám ti vedieť, keď dostanem ten e-mail.;;;
123;I’m looking forward to our collaboration.;Teším sa na našu spoluprácu.;;;
124;It’s common to make mistakes at the beginning.;Je bežné robiť chyby na začiatku.;;;
125;I was wondering if you have a moment.;Zaujímalo by ma, či máte chvíľku čas.;;;
126;That’s why I need your help.;To je dôvod, prečo potrebujem tvoju pomoc.;;;
127;I can’t afford to buy a new laptop right now.;Nemôžem si dovoliť kúpiť nový notebook práve teraz.;;;
128;What do you think about the new design?;Čo si myslíš o tom novom dizajne?;;;
129;It turns out that the shop is closed.;Ukázalo sa, že obchod je zatvorený.;;;
130;I’m happy to announce the winners.;S radosťou oznamujem víťazov.;;;
131;Have you ever tried driving a sports car?;Skúšal si niekedy šoférovať športové auto?;;;
132;It’s time to make a final decision.;Je čas urobiť konečné rozhodnutie.;;;
133;I’m considering changing my career path.;Zvažujem zmenu svojej kariérnej cesty.;;;
134;I’m surprised that he remembered my name.;Som prekvapený, že si pamätal moje meno.;;;
135;I don't mind staying a bit longer.;Nevadí mi zostať o niečo dlhšie.;;;
136;What’s the point of arguing about this?;Aký má zmysel sa o tomto hádať?;;;
137;I’m sorry for the misunderstanding.;Ospravedlňujem sa za nedorozumenie.;;;
138;I’m grateful for all your support.;Som vďačný za všetku vašu podporu.;;;
139;Could you tell me how to get to the station?;Mohli by ste mi povedať, ako sa dostanem na stanicu?;;;
140;It’s worth visiting the local museum.;Oplatí sa navštíviť miestne múzeum.;;;
141;I’m not interested in buying anything today.;Nemám záujem si dnes nič kúpiť.;;;
142;It’s impossible to predict the future.;Je nemožné predpovedať budúcnosť.;;;
143;I’m afraid that I have some bad news.;Obávam sa, že mám zlé správy.;;;
144;How about grabing a coffee after work?;Čo tak skočiť na kávu po práci?;;;
145;I’m not sure what to say in this situation.;Nie som si istý, čo v tejto situácii povedať.;;;
146;I’m convinced that we can win this.;Som presvedčený, že toto môžeme vyhrať.;;;
147;It’s likely that the prices will go up.;Je pravdepodobné, že ceny pôjdu hore.;;;
148;I’m used to it by now.;Už som si na to zvykol.;;;
149;It makes no sense to quit now.;Nedáva zmysel teraz skončiť.;;;
150;I’m in charge of the marketing department.;Mám na starosti marketingové oddelenie.;;;
151;I’m not certain about the exact time.;Nie som si istý presným časom.;;;
152;It’s obvious that they are lying.;Je zrejmé, že klamú.;;;
153;I’m aware of the consequences.;Som si vedomý následkov.;;;
154;What if we try a different approach?;Čo ak skúsime iný prístup?;;;
155;I’m disappointed in the quality of this product.;Som sklamaný z kvality tohto produktu.;;;
156;It’s crucial to follow the instructions.;Je kľúčové dodržiavať inštrukcie.;;;
157;I’m willing to negotiate the price.;Som ochotný vyjednávať o cene.;;;
158;I’m looking forward to it very much.;Veľmi sa na to teším.;;;
159;It’s a waste of time to argue with him.;Je to strata času sa s ním hádať.;;;
160;I’m worried about the upcoming deadline.;Mám obavy z blížiaceho sa termínu.;;;
161;I’m exhausted from the long journey.;Som vyčerpaný z dlhej cesty.;;;
162;It’s no use complaining about the weather.;Nemá zmysel sťažovať sa na počasie.;;;
163;I’m curious about your opinion.;Som zvedavý na váš názor.;;;
164;I’m responsible for the final report.;Som zodpovedný za záverečnú správu.;;;
165;It’s better to double-check everything.;Je lepšie všetko si dvakrát skontrolovať.;;;
166;I’m confident that the results will be good.;Som si istý, že výsledky budú dobré.;;;
167;I’m ashamed of my behavior yesterday.;Hanbím sa za svoje včerajšie správanie.;;;
168;It’s unusual for her to be so quiet.;Je pre ňu nezvyčajné byť tak potichu.;;;
169;I’m proud of how you handled the situation.;Som hrdý na to, ako si zvládol tú situáciu.;;;
170;I’m fed up with this constant noise.;Mám po krk tohto neustáleho hluku.;;;
171;It’s necessary to update the software.;Je nevyhnutné aktualizovať softvér.;;;
172;I’m serious about moving abroad.;Myslím to vážne so sťahovaním sa do zahraničia.;;;
173;I’m involved in a volunteer program.;Som zapojený do dobrovoľníckeho programu.;;;
174;It’s unlikely to snow in April.;Je nepravdepodobné, že bude v apríli snežiť.;;;
175;I’m frustrated with the slow internet.;Som frustrovaný z pomalého internetu.;;;
176;I’m addicted to this new TV series.;Som závislý na tomto novom seriáli.;;;
177;It’s helpful to take notes during the lecture.;Je užitočné robiť si počas prednášky poznámky.;;;
178;I’m shocked by the high electricity bill.;Som šokovaný vysokým účtom za elektrinu.;;;
179;I’m satisfied with my current salary.;Som spokojný so svojím súčasným platom.;;;
180;It’s dangerous to walk here at night.;Je nebezpečné sa tu v noci prechádzať.;;;
181;I’m passionate about environmental issues.;Som zapálený pre otázky životného prostredia.;;;
182;I’m nervous about the job interview.;Som nervózny z pracovného pohovoru.;;;
183;It’s polite to hold the door for others.;Je slušné podržať dvere ostatným.;;;
184;I’m optimistic about our future success.;Som optimista ohľadom nášho budúceho úspechu.;;;
185;I’m capable of solving this problem.;Som schopný tento problém vyriešiť.;;;
186;It’s important to keep a healthy lifestyle.;Je dôležité udržiavať si zdravý životný štýl.;;;
187;I’m bored with doing the same tasks.;Nudí ma robiť tie isté úlohy.;;;
188;I’m confused by the complex instructions.;Som zmätený z tých zložitých inštrukcií.;;;
189;It’s great to have you here.;Je skvelé, že vás tu máme.;;;
190;I’m allergic to cat hair.;Som alergický na mačaciu srsť.;;;
191;I’m focused on finishing my studies.;Sústredím sa na dokončenie štúdia.;;;
192;It’s illegal to smoke in this area.;V tejto oblasti je zakázané fajčiť.;;;
193;I’m scared of heights.;Bojím sa výšok.;;;
194;I’m keen on learning new technologies.;Veľmi ma baví učiť sa nové technológie.;;;
195;It’s essential to sleep at least 7 hours.;Je nevyhnutné spať aspoň 7 hodín.;;;
196;I’m thankful for your advice.;Som vďačný za vašu radu.;;;
197;I’m suspicious of their sudden kindness.;Som podozrievavý voči ich náhlej láskavosti.;;;
198;It’s hard for me to trust him again.;Je pre mňa ťažké mu znova dôverovať.;;;
199;I’m impressed by your progress.;Som ohromený tvojím pokrokom.;;;
200;It’s nice of you to invite us.;Je to od vás milé, že ste nás pozvali.;;;